,Id,Date published,Title,Channel title,View count,Like count,Comments count
0,eZg4026rlAM,2023-02-18T05:08:33Z,Đánh giá chi tiết Samsung Galaxy S23 Ultra: Đây mới là trải nghiệm Ultra | Vật Vờ Studio,Vật Vờ Studio,118899,1683,284
1,zKYZFj5QFeA,2023-02-20T14:30:30Z,Chiến Genshin Impact max độ họa với Samsung Galaxy S23 Ultra,Tinh tế,9423,115,31
2,HiAigBLn0lY,2023-02-01T18:26:52Z,Trên tay Samsung Galaxy S23 Ultra,Tinh tế,52437,493,103
3,kfYhDuJvzA0,2023-02-20T13:45:01Z,Samsung Galaxy S23 Ultra và những thay đổi “nhỏ”!,Tinh tế,23615,280,69
4,TlGmjKDaq5M,2023-02-07T13:00:17Z,Review nhanh Samsung Galaxy S23 Ultra,Tinh tế,18855,287,52
5,HtOsIE5Ks08,2023-02-01T18:02:34Z,Vinh Xô| Samsung Galaxy S23 Ultra: chỉ 6 phút là đủ,Vinh Xô,217104,2800,484
6,vF1w05RotNk,2023-04-18T12:20:33Z,Vinh Xô | Đánh giá chi tiết Samsung Galaxy S23 Ultra,Vinh Xô,195212,2007,451
7,nMk8gvz9fII,2023-03-15T05:08:24Z,Vinh Xô | Giải mã sự thật chụp trăng của Samsung Galaxy S23 Ultra là fake?,Vinh Xô,95147,1829,255
