Link,Title,Author,Post Date,Comments Count,Content
https://tinhte.vn/thread/samsung-galaxy-s23-ultra-anh-em-note-fan-con-cho-gi-nua.3640451/,Samsung Galaxy S23 Ultra: Anh em Note-fan còn chờ gì nữa?,Pnghuy,2/3/2023 16:5,239,"Không phải ngẫu nhiên mà dòng Galaxy Note lại được nhiều anh em yêu thích và lựa chọn đến như vậy, qua rất nhiều thế hệ, bao nhiêu thay đổi của thế giới smartphone thì hình ảnh chiếc điện thoại với cây bút stylus như Galaxy Note vẫn được coi là một sự khác biệt và sáng tạo, ngay cả trong những chi tiết, tính năng nhỏ nhất dành cho chiếc bút S Pen đó. Đã 3 năm kể từ lần cuối cùng Galaxy Note20 Ultra ra mắt thì có thể nói rằng,
Galaxy S23 Ultra
năm nay là kẻ kế thừa xứng đáng cho dòng Galaxy Note và nếu anh em còn đang đắn đo không biết liệu có nên chuyển sang S23 Ultra hay không, hãy đọc bài viết này nhé.
Từ Galaxy Note20 Ultra sang Galaxy S22 Ultra và bây giờ là Galaxy S23 Ultra, với góc nhìn cá nhân của mình, dòng Note chưa bao giờ bị khai tử hay biến mất, nó chỉ đang ở một hình thái khác, một màu áo mới mà ở đó,
Samsung
sẽ có thể chăm chút hơn, tối ưu nhiều hơn nữa để đem đến cho anh em fan dòng Note nói riêng và cả người dùng smartphone nói chung một thiết bị là tuyệt vời nhất có thể.
Hôm mình đi dự buổi mở bán Galaxy S23 Ultra, mình có thấy một số người đang sử dụng Galaxy Note20 Ultra, Galaxy Note10+ hay thậm chí là Galaxy Note9 quyết định đổi sang Galaxy S23 Ultra. Hỏi một anh đang sở hữu Galaxy Note20 Ultra rằng vì sao anh lại chuyển sang sử dụng Galaxy S23 Ultra thì anh nói rằng Note20 Ultra vẫn còn quá tốt sau ngần ấy thời gian sử dụng cho đến khi “tuổi tác” của nó bắt đầu đuối ở một số tác vụ, đặc biệt là camera.
Khá đáng tiếc khi anh bỏ qua Galaxy S22 Ultra khi cho rằng nó vẫn chưa thực sự mang giá trị của dòng Note nhưng mà không sao, vì dù gì bây giờ anh cũng đang dùng một chiếc Galaxy S23 Ultra được kiện toàn hơn từ hai người anh đi trước.
Anh em thấy rằng Galaxy S22 Ultra hay Galaxy S23 Ultra có một thiết kế vuông vức để mang lại
trải nghiệm
không khác về bất cứ điều gì so với dòng Galaxy Note cả. Từ trước đến nay nếu Galaxy S là một thiết kế bo cong, mềm mại thì Galaxy Note luôn có một thiết kế vuông vức hơn, ít bo cong hơn và đỉnh điểm là khi Samsung ra mắt Galaxy Note10 và thực tế rằng, cá nhân mình, Galaxy Note10 chính là chiếc điện thoại
Android
mà mình thích nhất ở thời điểm đó, và cho đến bây giờ nó vẫn là một chiếc điện thoại đẹp.
Riêng với Galaxy S23 Ultra, nó vẫn là thiết kế vuông vức nhưng được cải tiến nhiều cho trải nghiệm cầm nắm. Như Galaxy Note20 Ultra là khung sườn vuông nhưng mỏng, sang Galaxy S22 Ultra khung sườn vẫn vậy nhưng được làm dày hơn và Galaxy S23 Ultra thì khung sườn được vát phẳng. Nhìn thì nghĩ rằng đây là một thay đổi nhỏ nhưng mà không đâu anh em, nó cải thiện khả năng cầm nắm của chiếc điện thoại này nhiều lắm.
Galaxy S23 Ultra cá nhân mình cầm vào thấy tuy rằng nó vẫn to nhưng không còn trơn như khi cầm S22 Ultra nữa hay với Note20 Ultra trước đây. Lí do là vì bây giờ bàn tay của chúng ta đã có nhiều diện tích tiếp xúc với máy hơn, nó sẽ giúp cho việc sử dụng S Pen ghi chú cũng tuyệt vời hơn, độ bám tốt hơn. Ngoài ra, nếu anh em là người quan tâm đến môi trường thì Galaxy S23 Ultra được làm từ những vật liệu rất thân thiện như nhôm tái chế, kính tái chế, hộp từ nhựa tái chế 100%.
Về S Pen, không nghi ngờ gì đây chính là S Pen mà anh em đã từng yêu thích khi dùng Galaxy Note. Thực tế mà nói không có lí do gì khi Samsung trang bị S Pen cho Galaxy S mà lại cắt giảm tính năng so với dòng Note cả, đặc biệt là khi công nghệ ngày càng phát triển. Tất cả những tính năng mà anh em từng yêu thích trên S Pen của Galaxy Note đều không thiếu bất kì thứ gì: Screen Write, Smart Select, khả năng chụp ảnh bằng S Pen, các thao tác cử chỉ…Hoàn toàn là một cảm giác thân thuộc.
Nhưng mà dù gì đi chăng nữa thì thời gian không chờ đợi bất cứ ai, Galaxy Note20 Ultra dù đã từng là một chiếc điện thoại tuyệt vời nhưng cũng không tránh được những thua thiệt về mặt công nghệ, điển hình là về màn hình, camera và hiệu năng.
Galaxy S23 Ultra sở hữu tấm nền Dynamic AMOLED 2X rất đẹp, có thể nói là đỉnh nhất trong thế giới smartphone ở thời điểm hiện tại về chất lượng hiển thị, về thông số cấu hình. Tấm nền với độ sáng cao, màu sắc tuyệt vời, độ chính xác màu cao, ít cong hơn và công nghệ LTPO thế hệ mới giúp cho chiếc điện thoại này sử dụng năng lượng hiệu quả hơn, từ đó cải thiện về thời lượng sử dụng pin, nhưng mình sẽ chia sẻ về pin sau.
Điểm thứ hai mà Galaxy S23 Ultra sẽ làm cho những anh em Note-fan cảm thấy xứng đáng đó là camera. Dĩ nhiên là flagship “đỉnh” nhất của Samsung trong năm qua nên Galaxy S23 Ultra được Samsung chăm chút rất nhiều về việc chụp hình, từ phần cứng với cảm biến do chính dọ phát triển có độ phân giải lên đến 200MP.
Khả năng chụp đêm cũng được nâng cấp rất nhiều nếu so với những chiếc Note trước đây, khả năng zoom quang 10x, thuật toán được nâng cấp nhờ một phần ISP Cognitive từ Snadpragon 8 Gen 2, Nightography…Tất cả chắc chắn sẽ khiến anh em Note-fan hài lòng. Cá nhân mình khi dùng Galaxy S22 Ultra trước đây hay Galaxy S23 Ultra bây giờ đều rất thích camera tele của nó, đặc biệt là khả năng zoom 10x, nó thực sự tốt và có thể dùng ảnh được ngay. Một vài hình ảnh chụp chụp đêm và zoom từ Galaxy S23 Ultra để anh em xem và đánh giá:
Mời anh em xem thêm:

Nói về Snapdragon 8 Gen 2 “for Galaxy”, đây là điều lần đầu tiên xuất hiện trên một chiếc điện thoại Samsung nói riêng cũng như lần đầu tiên Qualcomm lại ưu ái cho một nhà sản xuất smartphone đến vậy khi hợp tác để tối ưu riêng. Cụm từ “for Galaxy” ở đây có nghĩa là có một sự nâng cấp nhẹ so với phiên bản Snapdragon 8 Gen 2 tiêu chuẩn. Đầu tiên chúng ta sẽ có xung nhịp CPU và GPU cao hơn, nhân Prime của Snapdragon 8 Gen 2 “for Galaxy” được đẩy lên đến 3.36GHz, trong khi thông thường chỉ là 3.19GHz mà thôi. GPU Adreno 740 cũng được đẩy xung nhịp lên 719MHz so với nguyên bản là 680MHz. Nếu nói theo cách thông thường thì Samsung đang được dùng trước phiên bản Snapdragon 8+ Gen 2 mà Qualcomm thường ra mắt ở khoảng thời gian nửa cuối, đây là sự ưu ái rất lớn và chứng tỏ Samsung đang có một vị thế khác so với các nhà sản xuất Android còn lại.
Hơn nữa, con SoC này cũng đem lại một tính năng vốn chỉ có trên những GPU dành cho máy tính - ray tracing. Công bố của Samsung tại sự kiện Unpacked đêm qua về sự vượt trội hiệu năng của CPU, GPU và NPU so với thế hệ trước lần lượt là 34%, 41% và 49%.
Về khả năng chơi game, mod
@MinhTriND
đã có bài trải nghiệm ở đây, với những tựa game hiện tại vì nó không thể làm khó được sức mạnh từ Snapdragon 8 Gen 2 “for Galaxy” mà Samsung đang sở hữu. Năm nay Samsung trang bị cho Galaxy S23 Ultra một hệ thống tản nhiệt lớn hơn so với thế hệ trước, đem lại khả năng quản lý nhiệt độ tốt,đặc biệt là sau một khoảng thời gian dài máy cũng không bị giảm độ sáng. Mình xin trích lại lời của mod Trí về việc đánh giá nhiệt độ của Galaxy S23 Ultra khi chơi PUBG Mobile:
“Dù ở điều kiện nào, nhiệt độ thân máy được quản lý tốt, dao động trong khoản từ 33 đến 40 độ C. Với tầm nhiệt này thì thân máy sẽ ấm ở vị trí nóng nhất và ở vị trí có nhiệt độ thấp hơn thì không đáng kể. Nhìn chung thì độ nóng thân máy này không khiến tay của mình khó chịu khi cầm. Nhờ tản nhiệt tốt nên hiệu năng được duy trì liên tục, mặc dù chơi cả tiếng nhưng không bị giật hoặc giảm độ sáng màn hình, điều thường thấy đối với thế hệ máy flagship trước đây của Samsung hay thậm chí là iPhone.”
Nặng hơn thì có tựa game Genshin Impact, máy cũng hoạt động hiệu quả và cho con số FPS dao động từ 55-60 FPS rất bình thường, nhiệt độ cũng rất ổn khi cao nhất chỉ là khoảng 43 độ mà thôi. Cá nhân mình đang rất muốn thử ray tracing trên Snapdragon 8 Gen 2, nhưng bản thân những tựa game đó chưa có nhiều và nếu có thì họ cũng chưa công bố chính thức về ray tracing, cho nên hẹn anh em vào một ngày gần nhất khi Arena Breakout chính thức hỗ trợ ray tracing nhé.
Ngoài SoC, RAM và bộ nhớ lưu trữ cũng ảnh hưởng đến khả năng hoạt động của điện thoại, năm nay Samsung lựa chọn bộ nhớ UFS 4.0 và RAM LPDDR5x, đều là những tiêu chuẩn mới nhất để dành cho Galaxy S23 Ultra. Bộ nhớ UFS 4.0 sẽ giúp anh em giải nén file nhanh hơn, cài đặt ứng dụng, di chuyển file và mọi tác vụ liên quan đến khả năng đọc ghi đều sẽ tốt hơn là UFS 3.1. Trong một thử nghiệm gần đây của mình thì memory copy của Galaxy S23 Ultra lên đến 18270MB/s, đọc tuần tự 1670MB/s và ghi tuần tự là 417.57MB/s, đều là những con số rất cao.
Một so sánh với đại diện sử dụng Snapdragon 8 Gen 2 tiêu chuẩn thì những bài test hoặc tác vụ đòi hỏi sức mạnh xử lý đơn nhân thì việc có nhân Prime (Cortex-X3) mạnh hơn của Galaxy S23 Ultra đã cho kết quả ấn tượng hơn.
Mình thấy rằng việc chuyển sang sử dụng SoC Snapdragon là một bước đi đúng đắn và kịp thời của Samsung. Việc hợp tác với hãng sản xuất chip lớn như Qualcomm đem lại nhiều cái lợi cho bản thân Samsung và người dùng của mình mà minh chứng lớn nhất là
Snapdragon 8 Gen 2 for Galaxy
, người dùng Samsung cũng sẽ cảm thấy bản thân mình đặc biệt hơn
😁
.
Một điểm nữa cũng làm nên sự khác biệt của việc hợp tác chặt chẽ giữa Samsung và Qualcomm, đó là sự tối ưu hoá về pin. Chiếc
Samsung Galaxy
S23 Ultra chỉ có dung lượng pin 5000mAh và chiếc điện thoại này hoàn toàn có thể có thời gian sử dụng lên đến gần 8 tiếng.
Trong sự kiện ra mắt Snapdragon 8 Gen 2, Qualcomm làm nổi bật thông số về hiệu năng trên mỗi watt điện của họ tăng đến 60%, và bản thân nhân Kryo nó cũng tăng 40% về khoản tiết kiệm điện so với thế hệ SoC tiền nhiệm. Như vậy anh em có thể thấy Galaxy S23 Ultra đã được hưởng lợi như thế nào về thời lượng sử dụng pin rồi.
Thực tế, qua những đánh giá và nhận xét từ những trang công nghệ trên thế giới thì đều có một nhận định chung rằng Samsung Galaxy S23 Ultra sẽ có thời lượng sử dụng pin không làm cho bất kì ai thất vọng. Điều này là sự kết hợp không chỉ giữa Samsung và Qualcomm mà còn cả Google nữa. Android 13 + One UI 5.1 và Snapdragon 8 Gen 2 for Galaxy thực sự đã đem lại sự khác biệt.
Không chỉ với dòng Galaxy S23 Ultra mà ngay cả phiên bản Galaxy S23 thường nó cũng đã nhận lại nhiều lời đánh giá tích cực về thời lượng dùng pin. Tìm hiểu một chút thì mình thấy rằng năm nay, Samsung đã sử dụng tấm nền thế hệ mới và chính tấm nền này nó giúp giảm đi 13-16% lượng điện tiêu thụ. Màn hình là một linh kiện tiêu tốn rất nhiều năng lượng và con số 16% kia nhìn thì nhỏ nhưng mà hiệu quả lại cao.
Nhìn chung về hiệu năng, tản nhiệt và thời lượng pin, Samsung Galaxy S23 Ultra năm nay làm thực sự tốt, Samsung đã giải quyết khá tốt bài toán về nhiệt lượng toả ra, anh em cũng biết rằng nhiệt độ cao nó sẽ ảnh hưởng đến pin ra sao rồi đúng không, chính vì vậy năm nay Samsung mạnh dạn đầu tư rất nhiều vào hiệu năng và tản nhiệt là vì thế. Snapdragon 8 Gen 2 for Galaxy rõ ràng là xung nhịp cao hơn, tối ưu riêng cho Galaxy S23 series mà vẫn có được nhiệt độ và thời lượng pin tốt, đây chính xác là một chiếc điện thoại gần như toàn diện về mọi mặt dành cho những anh em còn đang lăn tăn về Samsung Galaxy S23 Ultra có xứng đáng để thay thế dòng Galaxy Note hay không.

Việc thích hay không thích một chiếc điện thoại nào đó nó thuộc về cảm tính và cái nhìn chủ quan, đó là 2 yếu tố quan trọng nhất. Với Samsung Galaxy S22 Ultra năm ngoái đã nhận về nhiều sự nghi ngờ từ những người dùng Galaxy Note, với họ việc một chiếc Galaxy S “bỗng nhiên” lại mang trong mình nhiều giá trị của dòng Note đến như vậy, trong khi nhiều lời đồn về Galaxy Note sẽ bị “khai tử” làm vô hình chung chiếc S22 Ultra chịu nhiều điều tiếng, dù đó chính là một chiếc Note trong một cái tên mới. Nhưng bây giờ, với Galaxy S23 Ultra, nó thậm chí còn làm tốt hơn cả 2 người tiền nhiệm gần nhất của mình, thì không còn nhiều lí do gì những anh em Note-fan lại từ chối được chiếc điện thoại này.
Dòng Galaxy Note vẫn sẽ mãi là một dòng smartphone huyền thoại không chỉ của riêng Samsung, nó chính là khởi đầu cho câu chuyện smartphone màn hình lớn, hay khái niệm “phablet” mà nhiều anh em đã nghe qua và sau này nó đã trở thành tiêu chuẩn cho cả một ngành công nghiệp, Galaxy Note đã hoàn thành sứ mạng và bây giờ sự sáng tạo đó, sự đổi mới sẽ dành cho một cái tên mới: Galaxy S Ultra."
https://tinhte.vn/thread/200mp-tren-galaxy-s23-ultra-khi-crop-lai-co-chat-luong-hon-zoom-100x.3635071/,200MP trên Galaxy S23 Ultra khi crop lại có chất lượng hơn zoom 100x?,Hoàng Hải.,19/2/2023 3:9,129,"Như mình đã chia sẻ trước đây rằng chụp zoom 100x không mang quá nhiều ý nghĩa trong đời sống hằng ngày nhưng nếu trong trường hợp bắt buộc phải có những tình huống cần cắt xén hình và xem chi tiết tới mức tối đa, liệu 200MP khi crop nhỏ có thắng được zoom số 100x?
KHÔNG, CHẮC CHẮN LÀ KHÔNG.
Đây là câu trả lời của mình cho anh em, dù ở trong bất kỳ điều kiện hay hoàn cảnh chụp nào, thiếu sáng hay ngược sáng hay đủ sáng hay chụp đêm thì 200mp khi crop lại cũng sẽ không cho chi tiết bằng 1 chiếc camera riêng biệt dành cho việc zoom như chiếc cảm biến 10MP kia.
Về mặt lý thuyết, việc tăng số lượng pixel trên cảm biến không cải thiện chất lượng ảnh của điện thoại chụp ra quá nhiều mà chỉ đơn giản là tăng độ phân giải tối đa của chính cái cảm biến đó có thể chụp. Ảnh có độ phân giải cao thì chứa nhiều thông tin hơn nên anh em có thể phóng to và cắt ảnh mà không làm mất chi tiết. Nhưng nếu đem hình của 1 cảm biến (dù to) crop thật nhỏ lại mà so với chất lượng của 1 chiếc cảm biến khác thì thật khó, trừ khi cái cảm biến mà anh em đem đi crop phải rất lớn, còn trên những chiếc điện thoại, thì không thể.

Và cũng tương tự như khi ta so sánh
Galaxy S23 Ultra
và iPhone 14 Pro Max. Camera chính trên cả hai máy có kích thước cảm biến tương tự nhau: lần lượt là 1/1.3 inch và 1/1.28 inch. Nhưng kích thước của một pixel trên S23 Ultra chỉ là 0.6 micron còn với iPhone thì lên đến 1.22 micron.
Vậy có phải lúc nào Galaxy S23 Ultra cũng chụp ảnh lên đến 200MP?
KHÔNG!
Nó chỉ cho ra bức ảnh 12MP nhờ công nghệ pixel binning. Vì sao phải tạo ra công nghệ này? Vì gắn nhiều pixel vào cái cảm biến sẽ đặt ra một vấn đề mới là: pixel càng nhỏ thì mỗi pixel thu về càng ít ánh sáng dẫn đến tổng thể ảnh bị nhiễu. Mình đã nói chi tiết trong bài: ""
S23 Ultra có camera đến 200MP, vậy so với các hãng Trung Quốc có xu hướng cảm biến 1 inch thì sao?
"", anh em có thể xem lại.
Bởi vậy, mặc định khi chụp, S23 Ultra sẽ cho bạn 1 bức ảnh ở mức 12MP, anh em sẽ phải chọn nếu muốn chụp 1 bức 200MP hay 50MP. Khi chụp ở các chế độ có độ phân giải cao này, máy cũng sẽ tốn nhiều thời gian xử lý hơn, tầm 0.3 - 0.5 giây gì đó, nên nếu anh em muốn chụp đêm, chụp liên tục, chụp vật thể di chuyển thì quên chế độ 200MP này luôn đi.
Một bức ảnh 200MP sẽ cho ra kích thước 16.320 x 12.240 px ở tiêu cự 24mm. Còn với 1 bức ảnh zoom 100x, kích thước của nó là 4.000 x 3.000 px mặc định nhưng tiêu cự là 230mm (zoom số thành 2300mm, gấp gần 100 lần 24mm). Tức là sao? Tức là về cơ bản, máy sẽ dùng nguyên cái cảm biến 10MP riêng biệt zoom 10 lần lên rồi chụp lại 100% nhưng gì nó ghi nhận được vào thời điểm chụp với kích thước 4.000 x 3.000 px. Còn khi ta crop lại 100 lần, mình sẽ cho ra bức ảnh đâu là 160 x 120 px từ 200MP. Anh em sẽ thấy chất lượng rất khác nhau.
(Anh em click vào từng hình bên dưới để xem chi tiết rõ hơn)

Bên cạnh đó, áp dụng lý thuyết tương tự thì nếu anh em chụp 1 tấm hình ở chế độ 10x và crop nó ra để so với tấm ảnh đã được zoom 100x sẵn thì chất lượng cũng thua kém đi.

"
https://tinhte.vn/thread/moi-nguoi-mua-may-samsung-s23-ultra-ve-co-dung-but-nhieu-khong.3676542/page-2,Mọi người mua máy samsung S23 ultra về có dùng bút nhiều không ?,thế bảo ngô,2/6/2023 3:22,100,
https://tinhte.vn/thread/so-sanh-iphone-15-pro-max-va-galaxy-s23-ultra.3715879/,So sánh iPhone 15 Pro Max và Galaxy S23 Ultra,Didu,13/9/2023 5:38,192,"iPhone 15 Pro Max
đã ra mắt với rất nhiều nâng cấp và thay đổi, hãy thử so sánh với
Galaxy S23 Ultra
ra mắt nửa năm trước xem sự khác biệt này là gì. Mình tính so sánh cả Pixel 7 Pro nhưng như thế hơi thiệt cho điện thoại Google vì nó đã ra mắt cách đây một năm. S23 Ultra và
iPhone
15 Pro Max là hai đại diện ưu tú nhất cho điện thoại màn hình to, nhiều sức mạnh và thiết kế xịn.
Lần đầu tiên
Apple
sử dụng khung titan trên điện thoại iPhone, người dùng được hưởng lợi vì sẽ có một chiếc máy nhẹ hơn nhưng vẫn đảm bảo cứng và bền như thép. Lớp vỏ titan này được hoàn thiện kiểu mài xước ít bóng và ít bám vân tay so với iPhone 14 Pro Max. Trong khi đó, Galaxy S23 Ultra vẫn sử dụng khung nhôm thông thường, đang có những tin đồn cho rằng S24 Ultra cũng sử dụng titan như iPhone 15 Pro Max.
Tổng thể thì S23 Ultra bo cong màn hình và viền nhôm nên cầm ôm tay nhưng iPhone 15 Pro Max giờ đây cũng được vát cong nhẹ khung titan nơi tiếp giáp với màn hình và mặt lưng nên sẽ đỡ cấn hơn iPhone 14 Pro Max. Trọng lượng của iPhone 15 Pro Max là 221g, trong khi S23 Ultra là 234g. Độ dày thì iPhone 15 Pro Max là 8,3mm còn S23 Ultra là 8,9mm.
iPhone 15 Pro Max sở hữu màn hình 6""7, nhỏ hơn chút so với 6""8 của S23 Ultra. Màn hình của iPhone 15 Pro Max là Super Retina XDR OLED 120Hz, độ phân giải 1290 x 2796 điểm ảnh (460ppi) với độ sáng chuẩn 1000 nits và peak tối đa ngoài trời sáng là 2000 nits. Trong khi Galaxy S23 Ultra là Dynamic AMOLED 120Hz, độ phân giải 1440 x 3088 điểm ảnh (500ppi) với độ sáng 1200 nits (HBM) và peak ở 1750 nits. Nhìn chung thì đây vẫn sẽ là hai trong số ít những màn hình
smartphone
đẹp nhất, nét nhất mà anh em có thể tìm mua.
Apple trang bị cho iPhone 15 Pro Max chip A17 Pro trên tiến trình 3nm, lần đầu tiên con chip cho iPhone được đặt tên là Pro, có lẽ để phân biệt dòng máy Pro và dòng máy thường. Apple nâng cấp lớn cả về sức mạnh xử lý lẫn đồ họa, hứa hẹn đây sẽ là một chiếc máy cho sức mạnh cực kỳ kinh khủng, đặc biệt khi chơi game. Còn với S23 Ultra, máy dùng chip Snapdragon 8 Gen 2 tùy biến riêng cho Galaxy trên tiến trình 4nm. Anh em hãy chờ những bài test thực tế, bài so sánh kết quả benchmark khi Tinh tế có iPhone 15 Pro Max trên tay.
Quay video và xuất trực tiếp ra ổ cứng gắn ngoài.
Bộ nhớ trong của iPhone 15 Pro Max và S23 Ultra đều bắt đầu từ 256GB lên tới 1TB, trong khi RAM của S23 Ultra lên tới 12GB thì iPhone 15 Pro Max không được Apple công bố. Cả hai cũng sẽ đều sử dụng cổng kết nối USB-C tốc độ cao. iPhone 15 Pro Max sẽ tận dụng giao tiếp USB 3 cho các tác vụ cần tốc độ truy xuất cao như quay phim và lưu trực tiếp ra ổ gắn ngoài ở độ phân giải 4k 60fps.
Pin của S23 Ultra có dung lượng 5000mAh còn Apple không công bố. Nhưng họ có nói iPhone 15 Pro Max mất 30 phút để sạc 50% và tốc độ sạc không dây là 15W trong khi S23 Ultra sạc 30 phút được 65% và sạc không dây 15W, sạc dây 45W.
Độ phân giải camera của iPhone 15 Pro Max vẫn là 48MP nhưng năm nay ảnh chụp ra sẽ là 24MP trong khi S23 Ultra là 200MP và ảnh chụp ra 12MP. Cái hay trong camera của iPhone 15 Pro Max với mình sẽ là sự lựa chọn giữa 7 tiêu cự để chụp hình, mình rất thích điều này. Tức là giao diện chính của camera sẽ có các mức tiêu cự gồm 0,5x, 1x, 2x và 5x (zoom quang) nhưng với ống 1x tiêu chuẩn (cái chúng ta sử dụng nhiều nhất) sẽ có các lựa chọn tiêu cự 24mm, 28mm và 35mm. Lần đầu tiên xuất hiện tiêu cự 35mm trên iPhone, đó là tiêu cự mà rất nhiều máy ảnh cỡ nhỏ sử dụng, và chúng ta dùng ống kính 35mm nhiều nhất khi chụp cảnh vật, đường phố, con người…
Trong khi S23 Ultra sẽ có các ống kính siêu rộng, ống tiêu chuẩn 24mm, ống tele 3x và ống zoom quang lên tới 10x. Ống zoom 5x hay 10x chúng ta sẽ ít khi sử dụng thực tế, cái dùng nhiều nhất vẫn là ống tiêu chuẩn 1x.
Ảnh chụp bởi iPhone 15 Pro Max. Nguồn: Apple.
Giá bán mình tham khảo trên Apple Store Việt Nam cho iPhone 15 Pro Max bản 256GB sẽ là 34.999.000đ trong khi với S23 Ultra 256GB trên
Samsung
Store có giá 31.990.000đ. Dĩ nhiên đó là giá công bố từ Apple, Samsung, còn nếu mua tại các đại lý, cửa hàng có thể giá sẽ tốt hơn cho cả hai máy.
"
https://tinhte.vn/thread/dung-tam-3-nam-nua-nen-chon-samsung-s23-ultra-hay-iphone-15-pro-max.3754897/page-2,Dùng tầm 3 năm nữa nên chọn Samsung S23 ultra hay iPhone 15 pro max,Hữu Đăng Anh,9/1/2024 3:58,104,
https://tinhte.vn/thread/moi-nguoi-mua-may-samsung-s23-ultra-ve-co-dung-but-nhieu-khong.3676542/page-3,Mọi người mua máy samsung S23 ultra về có dùng bút nhiều không ?,thế bảo ngô,2/6/2023 3:22,100,
https://tinhte.vn/thread/mua-samsung-s23-ultra-dung-tam-2-3-nam-nua-co-on-khong-moi-nguoi.3735746/page-2,Mua samsung S23 ultra dùng tầm 2-3 năm nữa có ổn không mọi người?,Manhcuoglee,6/11/2023 3:41,100,
https://tinhte.vn/thread/chon-samsung-s23-ultra-hay-z-fold-5-dung-on-hon.3721708/page-3,chọn samsung S23 ultra hay Z fold 5 dùng ổn hơn ?,Nhật khôi huỳnh,30/9/2023 3:31,101,
https://tinhte.vn/thread/dung-tam-3-nam-nua-nen-chon-samsung-s23-ultra-hay-iphone-15-pro-max.3754897/page-3,Dùng tầm 3 năm nữa nên chọn Samsung S23 ultra hay iPhone 15 pro max,Hữu Đăng Anh,9/1/2024 3:58,104,
