Link,Title,Author,Post Date,Comments Count,Content
https://tinhte.vn/thread/so-sanh-samsung-galaxy-s23-ultra-va-iphone-13-promax.3718908/,So sánh Samsung Galaxy S23 Ultra và iPhone 13 Promax,Jason Hoang,22/9/2023 7:14,0,"Mức giá 18 - 20 triệu cũng khá là cao với đa số người, vì thế hôm nay tôi sẽ chỉ đi so sánh 2 chiếc điện thoại thôi nhé anh em. Đi luôn vào vấn đề chính thì đó chính là chiếc
iPhone 13 Promax
và chiếc
Samsung Galaxy S23 Ultra
. Hai chiếc máy này tại thời điểm hiện tại là tháng 9 năm 2023 thì đang có chung mức giá khoảng 18 - 20 triệu, tuỳ tình trạng và nơi bán nhé anh em. Lưu ý luôn từ đầu là nếu anh em mua máy cũ thì nên lựa chọn những địa điểm uy tín để tránh gặp rắc rối trong quá trình sử dụng nhé. Rồi, giờ chúng ta sẽ vào luôn phần chính của video. Hai chiếc máy này thì có gì và phù hợp với ai?
Trước hết cần phải hiểu là chiếc
iPhone
13 Promax nhà
Apple
đã ra mắt cách đây 2 năm và năm nay thì Apple đã ra mắt iPhone 15 Series rồi. Còn với chiếc
Samsung
Galaxy
S23 Ultra thì đang là flagship đầu bảng và mới nhất nhà Samsung vừa ra mắt năm nay. Vậy tại sao một chiếc điện thoại ra mắt 2 năm rồi lại có mức giá ngang bằng với 1 chiếc flagship mới ra mắt năm nay? Chắc các bạn đều thấy rõ là các thiết bị nhà Apple thường mất giá ít hơn so với những hãng khác, chắc do thị hiếu chung được ưa chuộng nhất thôi.
Đi sâu vào 2 chiếc máy, đầu tiên về thiết kế thì đây là phần không có gì quá nổi bật của cả 2 máy vì chúng đều có thay đổi rất nhỏ so với các thế hệ trước, vẫn theo những gì mà 2 hãng đang theo đuổi. Chi tiết anh em xem trên hình nha. Nhưng nói về trải nghiệm cầm nắm thì tôi đánh giá chiếc Samsung Galaxy S23 Ultra hơn. Tôi thì không sở hữu 2 chiếc máy này nhưng cũng có người quen dùng nên cũng được trải nghiệm, dù thời gian không dài nhưng thấy chiếc S23 Ultra bo cong nhẹ ở các mặt phẳng và các góc, khung viền nên cầm nắm lâu khá thoải mái. Còn trên chiếc iPhone 13 Promax thì khá là cấn tay vi khung viền được làm khá vuông, cùng đó màn hình cũng phẳng, lưng phẳng nên góc máy cầm lâu sẽ khá cấn và thậm chí đau tay. Cũng một phần vì chiếc máy iPhone 13 Promax này có trọng lượng lớn hơn chút ít nữa.
Tiếp theo về màn hình thì trước đây các hãng Android đang hơn đút Apple ở khoản tần số quét cao. Nhưng tới đời iPhone 13 Promax thì không còn nữa, chiếc máy này cũng trang bị tần số quét 120Hz, cộng với độ mượt trên IOS có sẵn thì rất ok, nhưng cũng chính vì iOS mượt sẵn nên khi sử dụng sự khác biệt không quá nhiều. Chi tiết hơn về màn hình thì chắc chắn chiếc Samsung Galaxy S23 Ultra sẽ hơn vì ra mắt sau với nhiều công nghệ mới hơn, đặc biệt là màn hình có độ sáng rất cao, lên tới 1750 nits, các công nghệ khác về màn hình cũng nổi bật hơn. Phần này thì tôi nghiêng về chiếc Samsung Galaxy S23 Ultra hơn nha.
Về Camera thì dù ra mắt trước 2 năm nhưng chiếc iPhone 13 Promax là một đối thủ rất đáng gờm, đặc biệt là trong khả năng quay phim và thu âm với tính năng Cinematic. Từ xưa tới nay thì 2 hãng đi theo 2 hướng khác nhau về cách làm phần mềm cũng như phần cứng camera. iPhone thì luôn đi theo sự chân thực còn Samsung thì luôn đi theo chiều hướng nịnh mắt và với 2 chiếc máy này cũng vậy. Tầm flagship rồi, ảnh chụp hay video cho các nhu cầu hàng ngày, up lên mạng xã hội thì 2 chiếc máy này đáp ứng quá tốt. Có một thứ mà chiếc Samsung Galaxy S23 Ultra hơn đó chính là khả năng quay video 8k so với chỉ 4k trên iPhone thôi."
https://tinhte.vn/thread/trai-nghiem-te-khi-mua-s23-ultra-tren-website-samsung.3638799/,Trải nghiệm tệ khi mua S23 ultra trên website samsung,Hienle0512,27/2/2023 2:49,214,"Samsung S23 series ra mắt với rất nhiều tính năng hay và thu hút người dùng để lên đời trải nghiệm.
Sau 1 thời gian dài không nâng cấp máy android vì các dòng chip Snap chưa cải thiện được nhiệt độ qua các thế hệ: Snap 888, Snap 8gen1. Và giờ đây Snap 8 gen 2 đã cải thiện rất nhiều về nhiệt độ và hiệu năng. Không kìm được sự phấn khích với những điều mới này, mình đã cố gắng tham gia pre-order để được mức giá tốt và nhiều quà tặng. Đặc biệt quà tặng rất tốt từ website samsung (sạc và ốp lưng da).
Sau khi hỏi các bác thương gia, thì thấy giá cũng xiêm xiêm trên website samsung. Vậy là mình chốt đặt trên website luôn cho chính chủ tên và có hóa đơn mua máy đầy đủ.
Và rồi chuỗi ngày phiền phức bắt đầu từ đây.
1.
Pre-order từ 2-17/2, trong tuần đầu tiên thì mình xem xét chờ xem review đầy đủ các kiểu để củng cố thêm thông tin về thiết bị. Và cũng dùng khoảng thời gian này để tìm hiểu nơi đặt hàng có giá tốt nhất. Tới khoảng 13-14/2 mình đã chốt và quyết xuống tiền đặt máy trên website samsung. Trên website có 2 dòng màu: 1 dòng thông thường - 1 dòng đặc biệt. Dòng thông thường đặt thì có ngay, dòng đặc biệt thì phải chờ sau 3-5 tuần. Do quá phấn khích nên mình chọn màu thông thường để đặt để sớm có máy vào 18/2. Nhưng tư vấn online trên website samsung báo là các phiên bản màu đã được đặt hết, giờ đặt thì giao hàng sẽ toàn sau 3-5 tuần. Anh chị cân nhắc để đặt hàng.
Nghe thông tin vậy, chả còn tâm trạng để pre-order nữa, thôi chờ 18/2 các bác thương gia có hàng về rồi mua luôn từ các bác thương gia vậy. Ai dè 18/2 hàng về ào ạt, kể cả màu đặc biệt mà website bảo sau 5 tuần mới có hàng cũng đầy cả ra. Nhiều bác trên nhóm facebook cũng khoe đặt hàng 15-17/2 thì 18/2 cũng đã có máy rồi.
→
Vậy là mình bị tư vấn viên cung cấp thông tin sai lệch để mình không thể tiến hành đặt hàng trên website.
2.
Sau khi thấy thị trường hàng hóa đầy ra thế kia, không lo vụ hết hàng nữa. Và samsung tiếp tục kéo dài đợt preoder từ 18/2-23/2. Vậy là mình lại tiếp tục có cơ hội để đặt hàng lại.
Mình cũng có người bạn đặt hàng hôm 19/2 và 22/2 đã nhận được máy. Thế đâu lo gì vụ thời gian nhận máy nữa. đặt ngay và thôi nào.
Vừa gọi tổng đài xong tầm 13h trưa 24/2 thì tầm 15h ngày 24/2 đơn hàng đã được bàn giao cho vận chuyển và sẽ giao vào ngày 25/2
→ Một lần nữa tổng đài hỗ trợ Samsung chỉ là bộ phận đọc thông tin trên website và truyền lại cho khách hàng, hoàn toàn không có khả năng liên hệ với các bộ phận liên quan hoặc có hệ thống riêng để cập nhật thêm thông tin cần thiết.
3.
Đỉnh điểm của mọi trải nghiệm cực kì tệ bắt đầu từ đây.
Sáng 8h ngày 25/2 hàng đã tới bưu cục gần nhà mình, và mình ra thẳng BC lấy cho nhanh vì quá phấn khích. Đưa máy thu cũ cho nhân viên check lại để tiến hành thu cũ.
Theo website các hạng mục kiểm tra chỉ có: phồng pin, cảm ứng màn hình, có bị khóa máy gì không.
Khi đến BC nhân viên vào
#0#  (ko gõ được dấu *)
để kiểm tra máy, cũng kiểm tra cảm ứng, màu sắc R-G-B-W, cảm ứng theo đường chéo và dọc viền máy. Tất cả hình ảnh được shipper chụp và gửi cho bên thẩm định Samsung. Cũng khá nhanh tầm 5 phút. Bên thẩm định chả biết dùng cách nào, báo màn bị âm ảnh. Không 1 lời giải thích hay bằng chứng nào cả.
Và nói đây là lỗi mắt thường không nhìn thấy được, tôi - shipper - NV BC cũng đều không thấy lỗi này bằng mắt thường.
Có những sự bất hợp lý như sau:
a. Lỗi âm ảnh không phải hạng mục đánh giá theo website/ bên thẩm định thêm hạng mục không cần báo trước cho khách hàng.
b. Lỗi do bên thẩm định nêu ra, không cung cấp bằng chứng và mô tả lỗi này như thế nào cho khách hàng.
c. Khách hàng hoàn toàn không được ý kiến và cũng không được cung cấp thêm thông tin/liên hệ hay trao đổi gì vì bên thẩm định toàn quyền quyết định.
Tôi đã đặt câu hỏi hỗ trợ trên samsung và nhận được câu trả lời âm ảnh là như thế này:"
https://tinhte.vn/thread/em-muon-may-samsung-s23-ultra-cua-ban-em-dung-suong-that.3635604/,Em mượn máy samsung s23 ultra của bạn em dùng sướng thật,vubeo89,18/2/2023 13:28,94,"Em mượn máy samsung s23 ultra của bạn em dùng sướng thật sự thấy thích hơn con 13 pro max em đang dùng,có anh em nào đổi từ iphone 13 pro max qua không em phân vân quá hay là mua thêm con s23 ultra nhỉ,mọi người cho em lời khuyên với ? Mà nếu mua thì có mua được ko tại bạn em nó đặt cọc máy trước ạ"
https://tinhte.vn/thread/mua-samsung-s23-ultra-cu-phai-may-tra-gop-thi-lam-the-nao.3662348/,Mua samsung S23 ultra cũ phải máy trả góp thì làm thế nào?,Hữu Đăng Anh,26/4/2023 7:20,96,"Anh họ mình mới mua con
samsung S23 ultra
mà đen cái là bị dính cái máy trả góp bảo sao mua được với giá bán rẻ hơn giá máy cũ trên thị trường,anh em mua máy samsung nên cẩn thận nhé không là dính máy trả góp đấy,hoặc mua máy mới cho yên tâm chứ máy cũ ko biết mua là ăn đạn ngay anh em à.mà có cách nào để phá cái trả góp để dùng máy không các bác?"
https://tinhte.vn/thread/moi-nguoi-mua-may-samsung-s23-ultra-ve-co-dung-but-nhieu-khong.3676542/,Mọi người mua máy samsung S23 ultra về có dùng bút nhiều không ?,thế bảo ngô,2/6/2023 3:22,100,"Em đang tính mua máy
samsung S23 ultra
mà thấy cái bút spen cũng không dùng mấy,mua về mà không dùng thấy phí mà chênh giá so với S23+ mấy tr,theo mọi người em nên chọn S23+ hay là S23 ultra hơn ạ?S23 ultra nó có hơn nhiều so với S23+ không ạ?"
https://tinhte.vn/thread/cac-bac-danh-gia-camera-cua-may-samsung-s23-ultra-nhu-nao.3720041/page-3,các bác đánh giá camera của máy samsung S23 ultra như nào ?,Tunie213,25/9/2023 8:31,101,
https://tinhte.vn/thread/cong-bo-ket-qua-binh-chon-anh-dep-galaxy-s23-ultra-dung-dau-iphone-14-pro-dung-cuoi.3633781/,"Công bố kết quả bình chọn ảnh đẹp: Galaxy S23 Ultra đứng đầu, iPhone 14 Pro đứng cuối",Hoàng Hải.,14/2/2023 14:25,347,"Trong bài chia sẻ cũ mình có nhờ các bạn bình chọn xem đâu sẽ là chiếc điện thoại có
camera
chụp hợp nhãn chúng ta nhất, trên tất cả các tiêu chí chứ không chia nhỏ ra thành ảnh chụp đêm, ảnh chân dung hay cảnh vật… Theo kết quả bình chọn này,
Galaxy S23 Ultra
là máy được anh em đánh giá cao nhất, hai máy 1"" là
Xiaomi 13 Pro
và
Vivo X90 Pro+
không chênh lệch nhau quá nhiều trong khi
iPhone 14 Pro
lại là máy nhận được ít bình chọn nhất.
Anh em chưa nào xem bài viết bình chọn, mời anh em xem lại:
Chọn ảnh đẹp nhất từ: iPhone 14 Pro, Mi 13 Pro, Vivo X90 Pro+ và Galaxy S23 Ultra
nhé!
Theo đó thứ tự các máy được bình chọn là :

Đúng vậy,
iPhone
trước nay vẫn luôn nổi tiếng là chiếc máy cho lại màu sắc khá sát với thực tế. Tuy nhiên, có vẻ như ở thời điểm hiện tại, nhiều anh em không còn thích màu của iPhone nữa. Dù chi tiết vẫn nhiều, cân bằng trắng tốt, kể cả ngoài trời hay điều kiện trong nhà thì iPhone đều xử lý mượt, nhưng nó không ấn tượng, không làm cho ta cảm thấy đẹp nếu anh em không chỉnh sửa, không xử lý hậu kỳ. Và điều đó càng rõ ràng hơn khi chúng ta đặt cạnh iPhone sát bên các máy được xử lý nhiều.
Màu vàng của chợ, màu xanh của trời, tất cả đều là những màu sắc sát với mắt nhìn của chúng ta nhất
Nhưng nếu để nói đâu là chiếc máy dành cho anh em yêu thích hậu kỳ, chỉnh sửa ảnh thì đó nên là
iPhone 14 Pro/Pro Max
, với khả năng chụp RAW tuyệt vời, mang lại cho anh em nhiều thứ để vọc vạch, nhiều cái thô sơ để khai thác.
Màu đó của xe đẩy hàng, màu đỏ của bảng nội quy và chữ màu vàng trên bảng, tất cả đều là những gam màu chuẩn nhất.
Sẽ là bất công nếu mình nhận định X90 Pro+ là một chiếc máy có camera kém. Nó không hề kém, sản phẩm có cảm biến lên đến 1 inch này có độ no màu cao, trong trẻo, dải tương phản động ngon. Nhưng như mình có chia sẻ trong bài:
“30 Phút với camera của Vivo X90 Pro+: lấy nét và chụp nhanh, màu sắc cân bằng, chân dung chưa ổn”
, anh em có quyền đòi hỏi nhiều hơn từ 1 chiếc flagship. Nếu so với hàng trăm chiếc máy đang được bán trên thị trường, Vivo có quyền tự tin, nhưng trong bài viết này, chúng ta phải nhận định rằng X90 Pro+ là chiếc máy có độ sai lệch màu nhiều nhất.
Anh em có thể dễ dàng nhận ra máy bị ám xanh và hồng nhiều nhất. Kỹ lưỡng hơn thì nếu đem các hình arh bỏ vào Photoshop hay Lightroom để cân bằng màu lại thì Sắc độ màu (Tint) và Nhiệt độ màu (Temperature) đều ngả về hai màu xanh và hồng. Và trong 3 nguyên tố RGB chủ đạo thì R và B cũng bị can thiệp sâu nhất.

Nếu mà nói đúng thì 13 Pro là chiếc smartphone mình cảm thấy tiếc nhất, vì những gì tuyệt vời nhất của camera, Xiaomi dường như dành cho dòng S mất rồi (12S Ultra).
13 Pro cho màu sắc hơi hơi ám vàng nhẹ và không quá trong. Nhưng về cơ bản, bức hình JPEG của Xiaomi rất ổn, bấm chụp xong là anh em xài được luôn, không cần lăn tăn quá nhiều, không cần hậu kỳ quá kỹ. Độ chói mà
Xiaomi
thiết lập trên sản phẩm này cũng rất tốt. Mình hầu như chưa từng gặp bức ảnh nào chênh sáng mà 13 Pro làm mình thất vọng, không bị cháy, không quá tối, chi tiết vừa đủ.
Anh em đọc lại bài:
4 lý do khiến mình đặc biệt thích Xiaomi Mi 12s Ultra
của
@cuhiep
để cảm nhận thêm về chất ảnh của 12S Ultra
Samsung năm nay đã có cuộc bứt phá ngoạn mục khi mang đến cho người dùng những bức ảnh không qua cần phải can thiệp quá nhiều, không cần chỉnh sửa quá chi tiết mà chụp xong là… xong. Mình đặc biệt thích chế độ chân dung và khả năng zoom quang 10x của nó. Mình đã chia sẻ ở bài: ""
Camera của Samsung Galaxy S23 Ultra: Một chiếc ""máy ảnh"" đường phố tuyệt vời!
""
, anh em có thể xem lại.
Màn hình của
S23 Ultra
cũng là chiếc màn hình được mod
@ndminhduc
đánh giá rất cao nên khi xem ảnh vừa chụp xong trên máy cũng có thể khiến anh em đủ phê rồi. Đối với mình, màu sắc của S23 vẫn khá rực rỡ, rực hơn Xiaomi 13 Pro, nhưng nó vừa phải, không nhiều như S22 Ultra và không… lố bịch như S21 Ultra.

Trong khuôn khổ 1 bài chia sẻ và 1 bài bình chọn ngắn, chúng ta có thể tạm thời kết luận rằng S23 Ultra đang làm rất tốt nhiệm vụ ghi hình của mình. Nhưng ở vài khía cạnh khác như chụp đêm, phơi sáng,… S23 Ultra không phải là kẻ bất bại. Đặc biệt, đối với các anh em thích quay phim, video trên iPhone vẫn là cái gì đó khác biệt so với thế giới smartphone.
Và còn hằng hà sa số các thứ khác quyết định với việc anh em lựa chọn sản phẩm nào như hệ điều hành, thương hiệu, giá bán,… để chúng ta xuống tiền, nhưng không sao, thắng thì cứ vui đã, đúng không anh em Samfan?"
https://tinhte.vn/thread/moi-nguoi-thay-camera-cua-samsung-s23-ultra-hon-hay-iphone-14-pro-max-hon.3663065/,Mọi người thấy camera của samsung S23 ultra hơn hay iPhone 14 pro max hơn?,Nhật khôi huỳnh,28/4/2023 3:33,97,"Mình vẫn chưa mua được máy vẫn lấn cấn chuyện cái camera của 2 máy là S23 ultra là
iPhone 14 pro max
không biết máy nào có camera oke hơn,mọi người thấy camera của con máy nào đi chụp ảnh du lịch đẹp hơn vậy mọi người?em thì cũng thấy hơi thích thích con S23 ultra không biết mua em máy đấy chụp ảnh với quay video có ổn không các bác?"
https://tinhte.vn/thread/s23-ultra-co-that-su-dang-mua.3652629/,S23 Ultra có thật sự đáng mua?,pretty.boy70,3/4/2023 4:34,4,"Theo khảo sát do Gsmarena tổ chức, đã có đến 57.59% người dùng quốc tế mong muốn được sở hữu Galaxy S23 Ultra, nhiều hơn gấp 4 lần so với nhận định chiếc máy không thuộc về mình.
Và thực tế đã chứng minh khi doanh số bán ra của Galaxy S23 Series tăng trưởng vượt trội hơn so với thế hệ tiền nhiệm cùng kỳ năm ngoái với số lượng Galaxy S23 Ultra chiếm tới 60% - theo CNBC. Chỉ tính riêng tại thị trường Việt Nam, doanh số Galaxy S23 Series ghi nhận mức tăng lên đến 60%.
Để có thêm thông tin cho anh chị em nào chuẩn bị hay có ý định mua thì tham khảo review mình tổng hợp bên dưới mang tính cá nhân từ vài anh em trong hội nhóm sau khi dùng S23 Ultra nhé (theo chỉ sẻ thì anh em không nhận 1 xu quảng cáo):
+ Về mức độ dùng: Thời gian sử dụng tầm 8-10h/ngày (theo app theo dõi pin báo, nhiều hén?). Sử dụng đa phần là chụp ảnh, các app đơn giản, youtube, tiktok, game nhẹ nhàng, trình duyệt web và vài ứng dụng khác.
Đánh giá cá nhân ip14prm vs s23u
Sau thời gian đắn đo có nên sử dụng máy SamSung không. Thì em đã sử dụng ss giữa (S23 Ultra 12G/512 với Iphone 13 Pro max). Hên có ""SS care +"" nên em yên tâm hơn nhiều
Cảm nhận cá nhân của em sau 14 ngày sử dụng S23 Ultra thiên về công việc:
- Trước tiên là ngoại hình đẹp, sang. Mỗi tội, em chưa tìm được cường lực ưng ý. Đang dùng miếng dán màn hình cùi bắp, nó cứ xục xịch….
- Em ấn tượng nhất về Pin của máy, sử dụng đến 22h hằng ngày mà Pin vẫn nằm ở mức tầm 49%...đây là điều mà em khá ưng ý với chiếc máy này không biết về lâu về dài như thế nào
- Máy sử dụng rất mượt, em thấy mượt ngang 13pm em đang dùng. Mục đích sử dụng công việc giải trí ít, game lặt vặt nên chưa thấy tình trạng giật lag hay bóp hiệu năng....
- Bút Spen rất hữu ích, đặc biệt là vừa nói chuyện, call... đều có thể note ghi chú nhanh
- Liên kết windows nhanh, tiện rất thuận tiện cho công việc văn phòng
- Chụp hình bao sống ảo, kkkk….Khá thú vị. Giải trí coi phim, review xem cực đã mắt....
Em đánh giá tổng thể 9/10 cho đến thời điểm hiện tại
Một số cái em thấy chưa thỏa lòng như:
- Nút âm lượng đặt cao, cùng bên nguồn. Bất tiện, hay bấm nhầm…Cảm giác hơi khó chịu
- Loa hình như hơi bé, nghe chưa được thu hút lắm
- 1 số app cv của cty hạn chế, chưa tích hợp trên Androi. Cái này em hơi cay cú
- 1 số game tàu, chơi không được…nhưng IOS lại được
- Phần Âm nhạc, không thêm list phát bằng PC đc, phải lọc bằng tay, Iphone thì đc. Video ko riêng tư được, nó nằm chung với hình. Kkkkk
- Excel ko copy ra Zalo file hình đc mà IP đc. Cái này em cần liên tục (nên điểm trừ lớn
)
- Chốt lại là em ưng bụng S23 Ultra đáng tiền để mua, thuyết phục được em chỉ thích IOS xưa giờ. Nào ngờ Androi xài nuột ngang ngửa…


"
https://tinhte.vn/thread/galaxy-s23-ultra-van-la-dinh-trong-the-gioi-android-dang-thanh.3633783/,Galaxy S23 Ultra vẫn là đỉnh trong thế giới Android dạng thanh,cuhiep,18/2/2023 11:34,355,"Mình có một năm không xài Galaxy Z Fold để dùng thử các điện thoại
Android
cao cấp khác nhau từ các hãng khác nhau để cuối cùng mình nhận ra là
Samsung
Galaxy dòng S Ultra vẫn là chiếc Android xịn nhất có thể cạnh tranh được với iPhone. Các hãng khác vẫn không kiểm soát được phần cứng và việc tối ưu phần mềm vẫn kém hơn Samsung.
Màn hình là điều quan trọng của Smartphone và
Galaxy S23 Ultra
đang ngon hơn bất cứ chiếc Android nào khác trên thị trường. Hai cái quan trọng tiếp theo là camera và hiệu năng thì
S23 Ultra
cũng nằm trong tốp mạnh nhất hoặc hơn các điện thoại khác. Một trong những lý do khiến S23 Ultra vượt trội hơn đó là Samsung tự chủ được nguồn linh kiện và không ngại hợp tác với kể cả đối thủ để nhằm mang đến chất lượng tốt hơn cho máy của họ.

Galaxy S23 Ultra có màn hình tràn viền, to, sáng và đẹp bậc nhất hiện nay. Theo mình thì đối thủ duy nhất có thể so được với S23 Ultra tổng thể về màn hình chỉ có iPhone 14 Pro Max và bản thân màn hình iPhone 14 Pro Max cũng là do một công ty Samsung khác làm ra. Anh em nào thích trải nghiệm màn hình di động, thích xem hình, chơi game hay coi nội dung trên màn hình đi động đẹp thì Galaxy S23 Ultra thực sự thoả mãn được anh em.

Năm rồi là năm mà các hãng đua nhau thay đổi hệ camera trên smartphone ở điện thoại của họ để giúp người dùng có thể chụp ảnh đẹp hơn. Các hãng Trung Quốc và Nhật thì chọn việc mang cảm biến lớn hơn (cụ thể là 1"") và kết hợp với các hãng làm ảnh danh tiếng trên smartphone của họ, iPhone 14 Pro có cảm biến vừa to hơn vừa độ phân giải cao hơn rất nhiều so với thế hệ trước. Samsung thì chọn việc mang cảm biến độ phân giải cực cao (200Mp) lên cũng như nâng cấp các camera tiêu cự khác.
Về cá nhân mình thì mình đang hài lòng nhất với Mi 12S Ultra, tuy nhiên trong nhiều hình chụp hơn và bình chọn mù thì anh em Tinhte.vn đã chọn hình ảnh từ Galaxy S23 Ultra vượt qua các smartphone xịn khác là: iPhone 14 Pro Max, Vivo X90 Pro+ và Xiaomi Mi 13 Pro (trong đó X90 Pro+ và Mi 13 Pro dùng cảm biến lớn, 1"").
Mình chưa có chụp nhiều hình với Galaxy S23 Ultra nhưng có chụp nhanh một tấm buổi sáng với camera 10X và rất ấn tượng với chất lượng mà nó đem lại, cũng như khả năng zoom quang đó.

Samsung đã không còn dùng chip do họ làm nữa vì nhiều năm không mang lại hiệu quả về hiệu năng như chip của Qualcomm. Tuy nhiên việc dùng chung chip với smartphone khác khó làm cho smartphone của họ vượt trội hơn về hiệu năng, trừ khi họ phải có một con chip gì đó đặc biệt hơn…

Mình chỉ nên ra ba yếu tố quan trọng nhất của một chiếc smartphone cao cấp để cho anh em thấy là Galaxy S23 Ultra vượt trội hẳn so với các máy Android khác trên thị trường. Và có vẻ trong năm nay thì tình hình cũng không thay đổi được nhiều vì cơ bản các hãng sẽ vẫn dựa trên các phần cứng và giải pháp tương tự, tầm gần cuối năm chúng ta mới có chip mới, hay cảm biến mới…"
https://tinhte.vn/thread/samsung-s23-ultra-tam-nay-mua-on-khong-vi-em-thay-sap-ra-s24-ultra-rui.3754027/page-2,Samsung S23 ultra tầm nay mua ổn không vì em thấy sắp ra S24 ultra rùi ?,minhthudoll,5/1/2024 3:40,101,
https://tinhte.vn/thread/co-nen-mua-samsung-s23-ultra-thi-truong-my.3733341/page-3,Có nên mua samsung S23 ultra thị trường mỹ ?,Hữu Đăng Anh,30/10/2023 4:15,101,
https://tinhte.vn/thread/gio-mua-samsung-s23-ultra-co-hop-ly-khong.3745389/page-2,Giờ mua samsung S23 ultra có hợp lý không ?,nguyễn chí uy,6/12/2023 4:46,102,
