Link,Title,Author,Post Date,Comments Count,Content
https://tinhte.vn/thread/tren-tay-samsung-galaxy-s23-ultra-minh-da-bi-lua.3629326/,Trên tay Samsung Galaxy S23 Ultra: mình đã bị lừa!,ndminhduc,1/2/2023 14:30,378,"Những hình ảnh rò rỉ và thậm chí là thư mời chính thức của sự kiện
Samsung
Unpacked đều tập trung vào phần mặt lưng với cụm 3 camera trên đó, không khỏi khiến cho mình (và mình nghĩ là nhiều anh em khác) cũng có suy nghĩ là thiết kế của nó không khác gì so với S22 Ultra trước đây. Camera là cái lẽ ra không cần phải nói tới quá nhiều trên một chiếc máy cao cấp nhất, trang bị những phần cứng mạnh mẽ nhất, phần mềm nhiều tính năng nhất tính đến hiện tại của Samsung.
Tất cả những điều trên khiến cho khoảng thời gian chờ đến ngày được
trên tay
máy đối với mình khá nhạt nhòa bởi tâm thế ""lại một mùa máy cao cấp mới ra mắt, vẫn công thức nâng cấp phần cứng, camera như iPhone mà thôi"".
Tuy nhiên, đến khi thực tế sờ vào máy, cầm nó trên tay và nghịch thử một số thứ, mình đã thay đổi hoàn toàn suy nghĩ về S23 Ultra năm nay và dưới góc độ nào đó, mình đã bị chính những hình ảnh rò rỉ lừa. Máy có những điểm thay đổi vô cùng tích cực, ảnh hưởng mạnh mẽ và trực tiếp tới trải nghiệm sử dụng của những người dùng cao cấp, giúp nó tiếp tục hứa hẹn là một chiếc máy cao cấp khác hoàn toàn so với S22 trước đây và xứng đáng là một trong những chiếc điện thoại tốt nhất mà nếu như không mua iPhone, sẽ mua S23 Ultra. Vậy những thay đổi đó là gì? Mời anh em.


Đây mới chính xác là những gì mà Samsung cần phải để cập tới khi teasing chiếc máy này bởi nó giúp S23 Ultra tách hoàn toàn ra khỏi chiếc bóng của S22 Ultra, giúp cho máy vừa mạnh mẽ hơn về mặt thị giác, sang trọng hơn, hiện đại hơn và cũng hợp thời hơn, đồng thời thể hiện được đội ngũ thiết kế của Samsung đã chọn giải pháp thông minh và làm tốt việc của họ đến mức nào.
Như góc nhìn này, anh em sẽ thấy rõ hơn phần viền 2 bên hông của máy được vát phẳng hơn. Trông vẫn sang, vẫn giữ lại nét sexy của một chiếc máy cao cấp. Dù vậy, phần tiếp giáp giữa mặt lưng và phần khung viền nhôm vẫn được hoàn thiện rất liền lạc, dễ chịu và cũng cứng cáp, không hề có hiện tượng gờ lên như giải pháp cắt phẳng hoàn toàn của một số máy khác.
Ở cạnh hông bên phải, chúng ta cũng sẽ có cụm phím tăng giảm âm lượng và tắt mở màn hình như truyền thống xưa giờ của Samsung. các nút được hoàn thiện cũng rất cứng cáp, chắc chắn.
Phần cạnh bên dưới được vát phẳng. Trên đó chúng ta vẫn có lỗ cắm USB-C, sạc nhanh 45W cho máy, cụm loa, mic và khe lắp SIM. Tất nhiên, chúng ta vẫn sẽ có bút S-Pen - cây bút đã giúp Samsung xây dựng được một lực lượng fan đông đảo từ nhiều năm qua.
Bút vẫn được lấy ra theo cách bấm vào và tự chạy ra một đoạn. Vẫn như thế hệ trước đây, độ trễ cảm ứng khi viết, các kết nối và cả cách hoàn thiện bút, kích thước bút vẫn tốt và cao cấp.
Cạnh trên của máy đơn giản là một mic và được vát phẳng.
Trên mặt lưng, các camera được bố trí theo kiểu rời nhau như trên S22 Ultra trước đây, để ý kỹ anh em sẽ thấy các cam sẽ to ra hơn so với trước.
Phiên bản mình mượn được là màu xanh lá, một trong nhiều màu sắc mới được Samsung làm cho S23 Ultra năm nay. Màu xanh trên phiên bản này sẽ được chuyển đổi sắc thái sang màu nòng súng, màu kim loại ở những góc độ khác nhau. Ngoài các màu đen và trắng truyền thống, chúng ta còn có màu mới và rất ấn tượng là hồng phấn, có cả các màu ""đặc biệt"" như màu xanh lá cây nữa,... Mình đánh giá cao việc trang bị nhiều màu cho chiếc máy này, góp phần mở rộng hơn phổ người dùng ở phân khúc cao cấp. Đồng thời, các màu mới sẽ giúp tăng nhiều hơn tính nhận diện của chiếc máy này, giúp định vị nó tốt hơn, giúp nó dễ dàng được nhận biết hơn, đặc biệt là so với S22 Ultra trước đây.
Samsung đã làm tốt nhất có thể, trang bị những thứ cao cấp nhất mà họ có cho chiếc S23 Ultra này. Chúng ta bắt đầu với màn hình Dynamic AMOLED 2X, kích thước 6.8 inch, độ sáng 1750 nit, tốc độ làm tươi 120Hz. Phần mặt kính Gorilla Glass Victus 2 được bẻ cong mạnh và rất nhỏ ở phần mép 2 bên. Cách làm này vô hình chung giúp phần viền thực sự của màn hình bên dưới vẫn tồn tại một cách vừa đủ, vừa đảm bảo máy vẫn đẹp về mặt thị giác, đồng thời đảm bảo không có hiện tượng chạm nhầm khi sử dụng bằng một tay.
Chúng ta vẫn sẽ có nốt ruồi chứa camera selfie độ phân giải 12MP ở vị trí chính giữa của màn hình. Samsung cho biết camera selfie cũng sẽ hỗ trợ chế độ chụp ảnh chuyên nghiệp và cũng được hỗ trợ các tính năng nhằm cải thiện chất lượng chụp ảnh, đặc biệt trong điều kiện thiếu sáng tốt hơn.
Về mặt phần cứng, S23 Ultra được trang bị chip Snapdragon 8 Gen 2 được Qualcomm và Samsung hợp tác sản xuất riêng, giúp nó được tối ưu hiệu năng hơn nữa cho Samsung. Đây không chỉ là con chip thuần túy có các nhân CPU hay GPU mạnh mẽ, mà nhờ được tập trung phát triển rất nhiều về khả năng xử lý bằng trí thông minh nhân tạo nên NPU, cho phép nó làm được nhiều việc hơn ngay dưới local, đồng thời tối ưu hóa nhiều hơn hiệu năng hoạt động của máy cả về các tác vụ nặng, chơi game ray tracing trên smartphone, cách tiêu thụ điện và cả việc hỗ trợ xử lý hình ảnh, chụp ảnh tốt hơn.
Samsung cho biết tản nhiệt trên S23 Ultra là dạng buồng hơi với kích thước lớn hơn thế hệ trước tận 30%, hứa hẹn sẽ giúp chiếc máy hoạt động mát hơn khi chơi game trong thời gian dài. Mình đã thủ sẵn account Genshin Impact, giờ chờ được mượn máy lâu hơn mình đi đánh la hoàng thử rồi báo cáo với anh em về cái này nhé.
Một số thông tin khác, chúng ta sẽ có 8GB RAM và tùy chọn bộ nhớ sẽ bắt đầu từ 256GB, có phiên bản 1TB cho anh em nhu cầu lưu trữ nhiều trên điện thoại. Về pin, chúng ta vẫn sẽ có viên pin 5000mAh, sạc nhanh có dây 45W và sạc không dây 15W. Như đã nói ở trên, nhờ vào việc tối ưu của Snapdragon 8 Gen 2 cơ bản về mặt tiêu thụ điện năng, nên mình khá tin tưởng rằng viên pin này sẽ kéo dài thời gian sử dụng của chiếc máy này ra dài hơn so với S22 Ultra trước đây. Tất nhiên, để mình có điều kiện test ít hôm rồi chia sẻ nhiều hơn với anh em.
Dĩ nhiên, Samsung cho biết camera của S23 Ultra cũng được nâng cấp lớn với điểm nhấn là cảm biến độ phân giải 200MP, chúng ta vẫn sẽ có công nghệ pixel binding gộp các điểm ảnh lại với nhau, chống rung cả quang học lẫn điện tử được áp dụng các thuật toán mạnh mẽ hơn nhằm mang lại hiệu suất chụp ảnh cao hơn. Việc nâng độ phân giải của cảm biến bên cạnh việc cải thiện về bản chất chất lượng hình ảnh, thì ngoài ra, việc hướng tới in ra những bức ảnh chụp bằng điện thoại cũng sẽ tốt hơn. Về khả năng quay video, S23 Ultra cho phép quay video 8K 30fps và 4K 120fps, quá đủ cho một thiết bị ghi hình.
Chi tiết thông số của các ống kính, chúng ta sẽ có:
Bên cạnh việc nâng cấp phần cứng, S23 Ultra cũng được nâng cấp về các chế độ chụp, như nhiều tính năng hơn ở chế độ chụp chuyên nghiệp, nâng khả năng chụp ảnh RAW 50MP, chế độ chuyên nghiệp ở cả camera selfie phía trước, chế độ chụp ảnh thiên văn và cả hyperlapse thiên hà Milkyway,…
Như thông lệ, S23 Ultra sẽ là chiếc máy được dùng để Samsung nâng cấp lớn giao diện OneUI của họ mà cụ thể ở đây là phiên bản 5.1. Bên cạnh các cải tiến về hiệu suất, bảo mật, thêm nhiều chế độ cá nhân hóa, thì OneUI 5.1 còn ưu ái cho Note Fan xưa giờ với các nâng cấp về tính năng cho S - Pen. Có thể nhắc tới đó chính là việc sử dụng được chữ viết tay bằng bút S Pen ngay khi đang viết note mà có tin nhắn tới, lúc đó người dùng chỉ đơn giản là trả lời tin nhắn bằng bút S - Pen luôn thay vì phải chuyển sang bàn phím ảo như trước đây. Sau đó, S23 Ultra sẽ tự nhận diện chữ viết tay (tất nhiên là có tiếng Việt) và chuyển thành text để người dùng gởi. Tính năng này dùng được với cả Facebook Messenger, Zalo, Telegram, Whatsapp,… khá tiện. Thay đổi nhỏ nhưng khá tinh tế này khiến mình khá ấn tượng với lần nâng cấp OneUI này.
Sẽ còn rất nhiều thứ về chiếc máy này, bọn mình sẽ dần thử nghiệm và báo với anh em sau nhé.
Thêm nhiều hình ảnh của Samsung Galaxy S23 Ultra.
Anh em quan tâm sản phẩm có thể xem
tại đây."
https://tinhte.vn/thread/galaxy-s23-ultra-co-bui-trong-camera-va-samsung-tra-loi-do-la-dieu-binh-thuong.3639395/,Galaxy S23 Ultra có bụi trong Camera và SamSung trả lời đó là.. điều bình thường,ChinhPhucThienHa,1/3/2023 4:7,510,"Chào các bạn, hôm nay mình muốn chia sẻ với các bạn một trải nghiệm không mấy vui vẻ khi sử dụng sản phẩm Flagship Samsung Galaxy S23 Ultra của mình. Bài chia sẽ hơi dài nên mình xin phép tóm tắt nhanh là: Sau 7 ngày sử dụng Galaxy S23 Ultra thì mình phát hiện trong ống kính camera zoom 10x có nhiều hạt bụi nhỏ, mình liên hệ TTBH SamSung được kĩ thuật viên xác nhận có đúng lỗi như trên và gửi yêu cầu đổi máy tới nhà máy SamSung. Nhà máy SamSung từ chối đổi máy mới cho mình với lý do “Điều này hoàn toàn bình thường, số lượng bụi nằm trong ngưỡng cho phép”. Mình không đồng ý với kết quả này và yêu cầu chuyển lên cấp cao hơn xử lý thì sau 2 ngày cũng nhận về kết quả tương tự.
Năm rồi, gia đình mình đón thêm thành viên mới, nên mình quyết định sẽ đổi một chiếc điện thoại mới có camera đẹp hơn, thay cho chiếc Galaxy Note 10+ đã hơn 3 năm tuổi của mình, để ghi lại những khoảnh khắc của con và gia đình. Mình không phải là Sam fan, cũng không phải là iFan, với mình sản phẩm nào cảm thấy phù hợp với bản thân thì mình xài. Điện thoại mình thích dùng Android vì sử thoải mái của nó, còn máy tính bảng thì mình chọn iPad. Nhưng… mình lại quyết định sẽ mua Iphone 14 Pro Max vì muốn chung hệ sinh thái với vợ, airdrop hình qua cho tiện và hơn nữa iPhone thực sự quay video rất đẹp. Và rồi lại nhưng… sau khi ra cửa hàng trải nghiệm iPhone 14 Pro Max thì mình lại quyết định không mua vì cái gọi là Dynamic Island to hơn trong suy nghĩ của mình, nhìn rất vướng víu, chứ không nhỏ xíu như cái nốt ruồi trên con Note10+ hiện tại. Thế là mình lại chờ S23 Ultra, sau khi xem buổi ra mắt, xem các bài trên tay, review của Tinh tế cũng như nhiều kênh nước ngoài khác và ra showroom trải nghiệm trực tiếp sản phẩm, mình quyết định đặt hàng trước S23 Ultra cũng như trade-in Note10+ trực tiếp trên web bán hàng của SamSung vào ngày 06/02/2023.
Mọi thứ diễn ra rất suôn sẻ, mình được giao hàng vào đúng ngày mở bán, quá trình kiểm tra máy thu cũ diễn ra nhanh chóng, và máy cũ của mình đáp ứng yêu cầu. Hôm đó mình vui nên có đăng
Fact
chia sẻ cùng anh em Tinh tế và được khá nhiều anh em vào chúc mừng. Về trải nghiệm máy thì đúng như mình kỳ vọng, máy đẹp, màn hình đẹp và mượt, chụp hình đẹp, quay video có cải thiện rõ rệt tuy nhiên cũng chưa thể so sánh với iPhone 14 được. Điều làm mình hụt hẫng nhất có lẽ là camera chính đổi thành tiêu cự 23mm, rộng hơn so với 27mm trên máy cũ Note10+, nên chụp vật thể hay người rất dễ bị méo ở rìa ảnh. Nhưng không sao điều này có thể khắc phục bằng cách zoom lên 1.2 khi chụp nên cũng không phải là vấn đề gì lớn.
Nhưng! đúng vậy lại là nhưng một từ có lẽ mình không muốn dùng nó một chút nào. Một ngày đẹp trời, chiều chủ nhật 26/02/2023 cả nhà mình đi cà phê, mình lấy S23 Ultra ra lau camera để chụp hình, thì lau hoài không hết bụi. Lúc đó mình mới nhận ra là có rất nhiều hạt bụi nhỏ bên trong ống kính zoom 10x, mình cũng không rõ là nó vào trong quá trình sử dụng hay có sẵn từ khi xuất xưởng. Hình phía dưới là hình của máy mình, còn hình cover mình mượn tạm hình của người dùng reddit do hình mình chụp không được chất lượng.
Mọi rắc rối bắt đầu từ đây, ngay chiều hôm đó mình mang máy ra TTBH của SamSung tại Đà Nẵng, nhưng hết giờ làm việc nên bạn kĩ thuật viên chỉ xác nhận là đúng máy mình có bụi trong ống kính camera và hẹn mình sáng mai mang ra để làm thủ tục đổi máy. Tối về, mình có dạo qua một vài hội nhóm người dùng SamSung trên Facebook, có một số người dùng cũng báo lỗi tương tự, nhưng khi báo hãng thì chỉ nhận được câu trả lời chung chung là “Số lượng bụi trong tiêu chuẩn cho phép” và từ chối đổi máy. Chỉ duy nhất một KH sau khi làm căng thì đã được đổi máy mới. Một vài hình ảnh những người dùng khác cũng gặp tình trạng giống mình trên các group facebook hay bài post về lỗi trên
Reddit
.
Quay trở lại với trường hợp của mình. Không từ bỏ hy vọng, sáng thứ 2 mình vẫn ra TTBH của SamSung để làm thủ tục đổi máy mới. Kỹ thuật viên tiếp nhận máy, xác nhận máy có bụi trong ống kính camera, nhưng báo với mình rằng việc đổi máy phải do nhà máy xác nhận, và bạn ấy sẽ giữ máy lại 2 đến 3 ngày để chụp hình ngoại quan gửi về cho nhà máy đánh giá.
Trưa hôm đó, bạn nhân viên gọi cho mình hỏi máy mình trả thẳng hay trả góp, mình thầm nghĩ chắc máy mình đã được duyệt đổi, vì mình trả thẳng thì thủ tục sẽ đơn giản hơn. Nhưng không phải vậy, chiều bạn ấy gọi cho mình thông báo nhà máy từ chối đổi máy vì nhà máy SamSung bảo đó là điều bình thường, số lượng bụi nằm trong tiêu chuẩn cho phép. Mình có hỏi lại bạn ấy là “Tiêu chuẩn nào cho phép? là có bao nhiêu hạt bụi trong camera? Tại sao tôi bỏ ra cùng một số tiền như người khác nhưng lại phải sử dụng sản phẩm kém chất lượng hơn?…”. Bạn ấy chỉ trả là là rất lấy làm tiếc cho mình, bạn ấy cũng muốn đổi máy cho mình nhưng quyết định cuối cùng là của nhà máy và hướng dẫn mình gọi tới số 1800588889 để làm việc trực tiếp với chăm sóc khách hàng của SamSung.
Mình tiếp tục gọi lên tổng đài CSKH của SamSung để phán ánh. Một bạn tổng đài viên tiếp nhận lại yêu cầu của mình, yêu cầu cung cấp thông tin đơn hàng cũng như số IMEI. Sau gần 20 phút chờ đợi, thì mình vẫn nhận lại được kết quả như vậy: “Em kiểm tra thấy máy của anh có phiếu trả kết quả của nhà máy là số lượng bụi nằm trong ngưỡng cho phép, và không được đổi mới, em rất lấy làm tiếc…"". Mình không chấp nhận kết quả này và bắt đầu căng thẳng, thì bạn ấy bảo sẽ chuyển lên cấp cao hơn tiếp nhận chứ bạn ấy cũng không quyết định được.
Sau 2 ngày làm việc thì sáng nay 01/03 mình nhận được điện thoại trả kết quả xử lý yêu cầu của SamSung, và kết quả cũng không khác với 2 lần trước. Bạn ấy thông báo rằng với trường hợp này bên em vẫn chưa thống nhất được phương án xử lý, kỹ sư SamSung xác nhận máy có bụi trong camera là hoàn toàn bình thường và mình có thể yên tâm sử dụng. Tất cả những câu hỏi mình đặt ra cho bạn tổng đài viên cũng như nhân viên kỹ thuật như: “Tại sao tôi bỏ một số tiền như người khác mà máy của họ không có bụi trong ống kính còn máy của tôi lại có?”, “Sản phẩm cao cấp gần 30 triệu của SamSung chất lượng như vậy có tương xứng không?”, “Tiêu chuẩn nào cho phép có bụi trong Camera và KH có biết được trong điều khoản mua hàng không?”, “Khi tôi bán lại máy liệu người mua có chấp nhận việc có bụi này là điều bình thường hay lại phải nhờ nhà máy xác nhận?”, “Bạn thấy chiếc iPhone nào có bụi như vậy chưa?”… Tất cả những gì mình nhận lại được chỉ là em ghi nhận câu hỏi và rất lấy làm tiếc. Và đây là biên bản mình nhận được khi đi nhận lại máy, mình đang yêu cầu cái tiêu chuẩn nào nhưng họ chưa cung cấp được.
Trên đây là những trải nghiệm của mình khi sử dụng Galaxy S23 Ultra dính lỗi có bụi trong ống kính Camera. Cảm ơn các bạn đã đọc! Theo các bạn điều này có bình thường không, là do mình khắt khe yêu cầu sản phẩm hoàn hảo, hay là do SamSung nghĩ người tiêu dùng Việt Nam dễ dãi nên bán sản phẩm lỗi? Bây giờ mình sẽ qua TTBH nhận lại máy và mình cũng không biết nên tiếp tục sử dụng hay bán lại nó, vì mình cũng không còn vui khi dùng nó nữa…
Khi qua TTBH nhận máy về vì không được chấp nhận đổi mới, mình có yêu cầu hãng cung cấp tiêu chuẩn về bụi trong camera nào cho rằng máy mình bị như vậy là bình thường. Nhân viên của TTBH bảo là đang mail cho nhà máy để xin và hẹn mình sẽ gửi qua Zalo. Và đây là kết quả mình nhận được sau gần 3 ngày làm việc, chỉ có 1 cái gọi là “tiêu chuẩn” chung chung bằng miệng.. và một lần nữa lại yêu cầu mình gọi lên tổng đài để được hỗ trợ.

Sau nhiều ngày làm việc, sáng nay - 09/03/2023 một bạn nhân viên CSKH của SamSung đã liên hệ cho mình. Trước khi đưa ra các phương án giải quyết, bạn ấy có điểm lại quá trình khiếu nại của mình, cũng như email mình đã gửi cho Ban giám đốc SamSung. Trước tiên, bạn ấy đưa ra 2 phương án giải quyết tốt nhất là:
Mình từ chối cả hai phương án vì với phương án 1, mình bỏ tiền như người khác thì mình cũng chỉ muốn được hưởng chính sách như vậy, mình không cần thêm làm gì cả. Còn đối với phương án 2 thì mình không muốn máy mình mất Zin. Tới đây thì mình cũng khá là bất ngờ vì bạn ấy đưa ra phương án:
Đổi máy mới cho mình và thời gian bảo hành máy mới sẽ là thời gian BH còn lại của máy cũ.
Mình sẽ được nhận máy mới trong vòng 7-10 ngày và khi nhận máy sẽ kiểm tra ngoại quan tại chỗ, khi mang máy về sẽ không được đổi nếu như có lỗi về ngoại quan. Mình có thắc mắc là máy mình đã hết thời gian 14 ngày đổi mới rồi, đâu còn được đổi mới nữa. Bạn ấy có giải đáp là: mình gửi yêu cầu trong thời gian đổi mới, SamSung ghi nhận mình là một KH tâm huyết và yêu mến các sản phẩm của SamSung, nên để mang lại trải nghiệm tốt hơn, cũng như để mình yên tâm sử dụng sản phẩm thì sẽ đặc biệt hỗ trợ đổi mới cho mình. Đây là chính sách riêng, linh động hỗ trợ cho mình, chứ nó không nằm trong điều khoản bảo hành cũng như chính sách đổi mới.
Mặc dù có hơi chậm, nhưng cũng cảm ơn vì SamSung đã lắng nghe và giải quyết yêu cầu của mình. Hi vọng sau lần này, anh em tinh tế nói riêng hay người tiêu dùng VN nói chung sẽ được trải nghiệm chất lượng sản phẩm cũng như dịch vụ CSKH tốt hơn từ SamSung.
Cảm ơn anh em đọc bài, theo dõi, góp ý cũng như lên tiếng cùng mình nhé!"
https://tinhte.vn/thread/moi-nguoi-danh-gia-sao-ve-samsung-s23-ultra-8gb-ram.3640898/,Mọi người đánh giá sao về samsung S23 ultra 8gb ram ?,minhthudoll,4/3/2023 3:26,97,"Mọi người mua
samsung S23 ultra
bản 8gb ram thấy  nó thế nào ? em tính mua bản đấy thôi mà nhiều người cứ khuyên lấy bản 12gb ram hơn nhưng mà em thấy giá nó chênh cao quá,dùng cơ bản thỉnh thoảng mới chơi game chắc lấy bản 8gb ram là oke mn nhỉ ?"
